{
  "$schema": "http://json-schema.org/draft-07/schema#",
  "$id": "bobreviewer/decision",
  "title": "bobreviewer decision record",
  "description": "Committed decision file under .bobreviewer/decisions/",
  "type": "object",
  "required": [
    "schema_version",
    "run_id",
    "repository",
    "file_path",
    "symbol",
    "base_commit",
    "head_commit",
    "probe_file",
    "probe_hash",
    "case_id",
    "observed_before",
    "observed_after",
    "verdict",
    "rationale",
    "status",
    "timestamp"
  ],
  "additionalProperties": false,
  "properties": {
    "schema_version": {
      "type": "string",
      "const": "1"
    },
    "run_id": {
      "type": "string",
      "format": "uuid",
      "description": "run_id of the evidence bundle this decision was made against"
    },
    "repository": {
      "type": "string",
      "description": "Remote origin URL — part of the history-match key"
    },
    "file_path": {
      "type": "string",
      "description": "Repo-relative path to the file containing the changed function — part of the history-match key"
    },
    "symbol": {
      "type": "string",
      "description": "Fully-qualified dotted name of the changed function — part of the history-match key"
    },
    "base_commit": {
      "type": "string",
      "pattern": "^[0-9a-f]{40}$"
    },
    "head_commit": {
      "type": "string",
      "pattern": "^[0-9a-f]{40}$"
    },
    "probe_file": {
      "type": "string",
      "description": "Repo-relative path to the probe file"
    },
    "probe_hash": {
      "type": "string",
      "description": "SHA-256 hex of the probe file bytes — links this decision to a specific, unchanged probe"
    },
    "case_id": {
      "type": "string",
      "description": "Stable case ID within the probe file this decision covers"
    },
    "observed_before": {
      "description": "Captured output from the base revision — any JSON value including exception records"
    },
    "observed_after": {
      "description": "Captured output from the head revision — any JSON value including exception records"
    },
    "verdict": {
      "type": "string",
      "enum": ["intended", "unintended", "unresolved"]
    },
    "rationale": {
      "type": "string",
      "description": "Must be non-empty when verdict is intended"
    },
    "status": {
      "type": "string",
      "enum": ["proposed"],
      "description": "Always written as proposed; approved status is derived from presence on the default branch"
    },
    "timestamp": {
      "type": "string",
      "format": "date-time"
    }
  },
  "if": {
    "properties": { "verdict": { "const": "intended" } }
  },
  "then": {
    "properties": {
      "rationale": { "type": "string", "minLength": 1 }
    }
  }
}
